{
  "$schema": "https://sofo.peterlyons.org/schema/sf-1.schema.json",
  "title": "Blame It On The Boogie",
  "artist": "The Jacksons",
  "key": "Eb",
  "groove": "Four-on-the-floor disco",
  "time": "4/4",
  "tempo": 120,
  "countOff": "Drums: 4 on the hi-hat",
  "notes": [
    "Watch the stops before each chorus.",
    "Keys own the horn stabs; guitar stays on 16th-note skank."
  ],
  "updated": "2026-07-26T13:54:00Z",
  "sections": [
    {
      "name": "intro",
      "notes": ["Horns pick up on bar 5."],
      "phrases": [{ "chords": ["Eb", "", "", ""] }, { "chords": ["Ab/Eb", "", "Bb7", ""] }]
    },
    {
      "name": "verse",
      "phrases": [
        { "chords": ["Ebmaj7", "Fm7", "Gm7", "Ab6"] },
        { "chords": ["Ebmaj7", "Fm7", ["Gm7", "Ab6"], "Bb7sus4"] }
      ]
    },
    {
      "name": "prechorus",
      "phrases": [{ "chords": ["Cm7", "Fm7", "Bb7", "Ebmaj7"] }]
    },
    {
      "name": "chorus",
      "phrases": [
        { "chords": ["Ab", "Bb", "Eb", ""] },
        { "chords": ["Ab", "Bb", ["Eb", "Cm7"], "Fm7"] }
      ]
    },
    {
      "name": "verse",
      "phrases": [
        { "chords": ["Ebmaj7", "Fm7", "Gm7", "Ab6"] },
        { "chords": ["Ebmaj7", "Fm7", ["Gm7", "Ab6"], "Bb7sus4"] }
      ]
    },
    {
      "name": "prechorus",
      "phrases": [{ "chords": ["Cm7", "Fm7", "Bb7", "Ebmaj7"] }]
    },
    {
      "name": "chorus",
      "phrases": [
        { "chords": ["Ab", "Bb", "Eb", ""] },
        { "chords": ["Ab", "Bb", ["Eb", "Cm7"], "Fm7"] }
      ]
    },
    {
      "name": "bridge",
      "notes": ["Half-time feel. Everybody down to a whisper."],
      "phrases": [{ "chords": ["Cm7", "", "Ab6", ""] }, { "chords": ["Fm7", "", "Bb7sus4", "Bb7"] }]
    },
    {
      "name": "solo",
      "notes": ["16 bars, guitar. Rhythm section keeps the chorus groove."],
      "phrases": [
        { "chords": ["Ab", "Bb", "Eb", ""] },
        { "chords": ["Ab", "Bb", "Eb", ""] },
        { "chords": ["Ab", "Bb", "Eb", "Cm7"] },
        { "chords": ["Fm7", "Bb7", "Eb", ""] }
      ]
    },
    {
      "name": "chorus",
      "phrases": [
        { "chords": ["Ab", "Bb", "Eb", ""] },
        { "chords": ["Ab", "Bb", ["Eb", "Cm7"], "Fm7"] }
      ]
    },
    {
      "name": "outro",
      "notes": ["Vamp on the last two bars."],
      "phrases": [{ "chords": ["Ab", "Bb", "Eb", ""] }, { "chords": ["Ab", "Bb"] }]
    }
  ],
  "endNotes": [
    "Outro vamps until the band leader cuts it — watch for the raised hand."
  ]
}
